{
  "endpoints": {
    "compact_feed": "https://raw.githubusercontent.com/JimBLogic/CyberDailyLog/main/reports/portfolio-feed.json",
    "dashboard_feed": "https://raw.githubusercontent.com/JimBLogic/CyberDailyLog/main/reports/dashboard-feed.json",
    "full_report": "https://raw.githubusercontent.com/JimBLogic/CyberDailyLog/main/reports/latest.json",
    "repository": "https://github.com/JimBLogic/CyberDailyLog",
    "source_health": "https://raw.githubusercontent.com/JimBLogic/CyberDailyLog/main/reports/source-health.json"
  },
  "generated_at": "2026-10-14T11:25:39+00:00",
  "history": [
    {
      "above_threshold": 357,
      "assessed": 772,
      "critical": 51,
      "date": "2026-09-15",
      "degraded": false,
      "generated_at": "2026-09-15T14:35:47+00:00",
      "high": 185,
      "immediate_attention": 0,
      "low": 66,
      "medium": 184,
      "minimum_priority": 5.0,
      "security_items": 768,
      "sources_healthy": 8,
      "sources_total": 8,
      "unknown": 282
    },
    {
      "above_threshold": 1217,
      "assessed": 1737,
      "critical": 167,
      "date": "2026-09-16",
      "degraded": false,
      "generated_at": "2026-09-16T14:31:48+00:00",
      "high": 824,
      "immediate_attention": 1,
      "low": 51,
      "medium": 283,
      "minimum_priority": 5.0,
      "security_items": 1734,
      "sources_healthy": 8,
      "sources_total": 8,
      "unknown": 409
    },
    {
      "above_threshold": 445,
      "assessed": 556,
      "critical": 81,
      "date": "2026-09-17",
      "degraded": false,
      "generated_at": "2026-09-17T14:35:46+00:00",
      "high": 242,
      "immediate_attention": 0,
      "low": 39,
      "medium": 178,
      "minimum_priority": 5.0,
      "security_items": 552,
      "sources_healthy": 8,
      "sources_total": 8,
      "unknown": 12
    },
    {
      "above_threshold": 143,
      "assessed": 221,
      "critical": 17,
      "date": "2026-09-18",
      "degraded": false,
      "generated_at": "2026-09-18T14:06:58+00:00",
      "high": 88,
      "immediate_attention": 0,
      "low": 15,
      "medium": 90,
      "minimum_priority": 5.0,
      "security_items": 215,
      "sources_healthy": 8,
      "sources_total": 8,
      "unknown": 5
    },
    {
      "above_threshold": 655,
      "assessed": 791,
      "critical": 98,
      "date": "2026-09-19",
      "degraded": false,
      "generated_at": "2026-09-19T13:42:15+00:00",
      "high": 399,
      "immediate_attention": 3,
      "low": 41,
      "medium": 224,
      "minimum_priority": 5.0,
      "security_items": 789,
      "sources_healthy": 8,
      "sources_total": 8,
      "unknown": 27
    },
    {
      "above_threshold": 109,
      "assessed": 156,
      "critical": 10,
      "date": "2026-09-20",
      "degraded": false,
      "generated_at": "2026-09-20T13:52:45+00:00",
      "high": 49,
      "immediate_attention": 0,
      "low": 19,
      "medium": 57,
      "minimum_priority": 5.0,
      "security_items": 156,
      "sources_healthy": 8,
      "sources_total": 8,
      "unknown": 21
    },
    {
      "above_threshold": 186,
      "assessed": 275,
      "critical": 25,
      "date": "2026-09-21",
      "degraded": false,
      "generated_at": "2026-09-21T16:09:13+00:00",
      "high": 124,
      "immediate_attention": 2,
      "low": 46,
      "medium": 71,
      "minimum_priority": 5.0,
      "security_items": 270,
      "sources_healthy": 8,
      "sources_total": 8,
      "unknown": 4
    },
    {
      "above_threshold": 41,
      "assessed": 63,
      "critical": 4,
      "date": "2026-09-22",
      "degraded": false,
      "generated_at": "2026-09-22T11:06:16+00:00",
      "high": 27,
      "immediate_attention": 0,
      "low": 3,
      "medium": 19,
      "minimum_priority": 5.0,
      "security_items": 62,
      "sources_healthy": 8,
      "sources_total": 8,
      "unknown": 9
    },
    {
      "above_threshold": 586,
      "assessed": 834,
      "critical": 104,
      "date": "2026-09-23",
      "degraded": false,
      "generated_at": "2026-09-23T10:02:03+00:00",
      "high": 315,
      "immediate_attention": 5,
      "low": 36,
      "medium": 255,
      "minimum_priority": 5.0,
      "security_items": 827,
      "sources_healthy": 8,
      "sources_total": 8,
      "unknown": 117
    },
    {
      "above_threshold": 477,
      "assessed": 814,
      "critical": 61,
      "date": "2026-09-24",
      "degraded": false,
      "generated_at": "2026-09-24T11:05:29+00:00",
      "high": 257,
      "immediate_attention": 2,
      "low": 51,
      "medium": 287,
      "minimum_priority": 5.0,
      "security_items": 808,
      "sources_healthy": 8,
      "sources_total": 8,
      "unknown": 152
    },
    {
      "above_threshold": 26,
      "assessed": 83,
      "critical": 13,
      "date": "2026-09-25",
      "degraded": false,
      "generated_at": "2026-09-25T10:01:29+00:00",
      "high": 32,
      "immediate_attention": 2,
      "low": 6,
      "medium": 29,
      "minimum_priority": 5.0,
      "security_items": 80,
      "sources_healthy": 7,
      "sources_total": 8,
      "unknown": 0
    },
    {
      "above_threshold": 1536,
      "assessed": 2553,
      "critical": 151,
      "date": "2026-09-26",
      "degraded": false,
      "generated_at": "2026-09-26T10:04:47+00:00",
      "high": 1004,
      "immediate_attention": 23,
      "low": 132,
      "medium": 739,
      "minimum_priority": 5.0,
      "security_items": 2545,
      "sources_healthy": 8,
      "sources_total": 8,
      "unknown": 519
    },
    {
      "above_threshold": 259,
      "assessed": 303,
      "critical": 26,
      "date": "2026-09-27",
      "degraded": false,
      "generated_at": "2026-09-27T10:04:12+00:00",
      "high": 163,
      "immediate_attention": 0,
      "low": 8,
      "medium": 86,
      "minimum_priority": 5.0,
      "security_items": 302,
      "sources_healthy": 8,
      "sources_total": 8,
      "unknown": 19
    },
    {
      "above_threshold": 152,
      "assessed": 191,
      "critical": 13,
      "date": "2026-09-28",
      "degraded": false,
      "generated_at": "2026-09-28T10:02:01+00:00",
      "high": 53,
      "immediate_attention": 2,
      "low": 29,
      "medium": 91,
      "minimum_priority": 5.0,
      "security_items": 189,
      "sources_healthy": 8,
      "sources_total": 8,
      "unknown": 3
    },
    {
      "above_threshold": 305,
      "assessed": 433,
      "critical": 43,
      "date": "2026-09-29",
      "degraded": false,
      "generated_at": "2026-09-29T10:04:41+00:00",
      "high": 162,
      "immediate_attention": 0,
      "low": 51,
      "medium": 158,
      "minimum_priority": 5.0,
      "security_items": 428,
      "sources_healthy": 8,
      "sources_total": 8,
      "unknown": 14
    },
    {
      "above_threshold": 625,
      "assessed": 965,
      "critical": 97,
      "date": "2026-09-30",
      "degraded": false,
      "generated_at": "2026-09-30T10:03:34+00:00",
      "high": 356,
      "immediate_attention": 2,
      "low": 59,
      "medium": 320,
      "minimum_priority": 5.0,
      "security_items": 960,
      "sources_healthy": 8,
      "sources_total": 8,
      "unknown": 128
    },
    {
      "above_threshold": 1910,
      "assessed": 2554,
      "critical": 253,
      "date": "2026-10-01",
      "degraded": false,
      "generated_at": "2026-10-01T10:04:51+00:00",
      "high": 1055,
      "immediate_attention": 10,
      "low": 180,
      "medium": 1026,
      "minimum_priority": 5.0,
      "security_items": 2551,
      "sources_healthy": 8,
      "sources_total": 8,
      "unknown": 37
    },
    {
      "above_threshold": 100,
      "assessed": 149,
      "critical": 22,
      "date": "2026-10-02",
      "degraded": false,
      "generated_at": "2026-10-02T11:03:58+00:00",
      "high": 55,
      "immediate_attention": 3,
      "low": 3,
      "medium": 50,
      "minimum_priority": 5.0,
      "security_items": 147,
      "sources_healthy": 8,
      "sources_total": 8,
      "unknown": 17
    },
    {
      "above_threshold": 361,
      "assessed": 518,
      "critical": 46,
      "date": "2026-10-03",
      "degraded": false,
      "generated_at": "2026-10-03T10:01:43+00:00",
      "high": 210,
      "immediate_attention": 6,
      "low": 20,
      "medium": 201,
      "minimum_priority": 5.0,
      "security_items": 517,
      "sources_healthy": 8,
      "sources_total": 8,
      "unknown": 40
    },
    {
      "above_threshold": 127,
      "assessed": 152,
      "critical": 16,
      "date": "2026-10-04",
      "degraded": false,
      "generated_at": "2026-10-04T10:06:22+00:00",
      "high": 70,
      "immediate_attention": 3,
      "low": 11,
      "medium": 42,
      "minimum_priority": 5.0,
      "security_items": 150,
      "sources_healthy": 8,
      "sources_total": 8,
      "unknown": 11
    },
    {
      "above_threshold": 99,
      "assessed": 181,
      "critical": 19,
      "date": "2026-10-05",
      "degraded": false,
      "generated_at": "2026-10-05T10:04:00+00:00",
      "high": 23,
      "immediate_attention": 3,
      "low": 28,
      "medium": 69,
      "minimum_priority": 5.0,
      "security_items": 176,
      "sources_healthy": 8,
      "sources_total": 8,
      "unknown": 37
    },
    {
      "above_threshold": 652,
      "assessed": 1111,
      "critical": 117,
      "date": "2026-10-06",
      "degraded": false,
      "generated_at": "2026-10-06T10:02:15+00:00",
      "high": 327,
      "immediate_attention": 2,
      "low": 82,
      "medium": 339,
      "minimum_priority": 5.0,
      "security_items": 1109,
      "sources_healthy": 8,
      "sources_total": 8,
      "unknown": 244
    },
    {
      "above_threshold": 718,
      "assessed": 1016,
      "critical": 125,
      "date": "2026-10-07",
      "degraded": false,
      "generated_at": "2026-10-07T11:04:52+00:00",
      "high": 376,
      "immediate_attention": 1,
      "low": 33,
      "medium": 309,